url,text
https://malayalam.indianexpress.com/news/coronavirus-amid-attacks-home-minister-amit-shah-assures-doctors-of-their-safety-365848/,"ന്യൂഡൽഹി: കോവിഡ് പ്രതിരോധ പ്രവർത്തനങ്ങൾക്കായി മുൻനിരയിൽ നിന്നുകൊണ്ടുള്ള ഡോക്ടർമാരുടെ പോരാട്ടത്തിന് അഭിനന്ദനമറിയിച്ച് കേന്ദ്ര ആഭ്യന്തരമന്ത്രി അമിത് ഷാ. ഇന്ത്യന്‍ മെഡിക്കല്‍ അസോസിയേഷന്‍ പ്രതിനിധികളുമായും ഡോക്ടര്‍മാരുമായും വീഡിയോ കോണ്‍ഫറന്‍സ് വഴി സംസാരിക്കുകയായിരുന്നു അമിത് ഷാ. ആരോഗ്യ പ്രവര്‍ത്തകര്‍ക്ക് നേരെ നടന്ന അതിക്രമങ്ങള്‍ രാജ്യത്ത് ഒരുപാട് റിപ്പോര്‍ട്ട് ചെയ്തിരുന്നു. ഈ സാഹചര്യത്തിലാണ് ആരോഗ്യമന്ത്രി ഡോ.ഹർഷ് വർധനോടൊപ്പം ഷാ വീഡിയോ കോൺഫറൻസ് നടത്തിയത്.

Read More: സർക്കാർ ജീവനക്കാരുടെ ആറു ദിവസത്തെ ശമ്പളം 5 മാസം പിടിക്കാൻ മന്ത്രിസഭാ തീരുമാനം

സർക്കാർ ഒപ്പമുണ്ടെന്ന് പറഞ്ഞ അമിത് ഷാ, ബുധനാഴ്ച ആസൂത്രണം ചെയ്ത പ്രതീകാത്മക പ്രതിഷേധം പിൻവലിക്കണമെന്ന് ഡോക്ടർമാരോട് അഭ്യർത്ഥിച്ചു. ഡോക്ടർമാർ അടക്കമുള്ള ആരോഗ്യപ്രവർത്തകർക്ക് നേരെ നടക്കുന്ന അതിക്രമത്തിൽ പ്രതിഷേധവുമായി ഇന്ത്യന്‍ മെഡിക്കല്‍ അസോസിയേഷന്‍ രംഗത്ത് വന്നിരുന്നു. ഇന്ന് രാത്രി ഒമ്പത് മണിക്ക് ആശുപത്രികളിലും വീടുകളിലും മെഴുകുതിരി കത്തിച്ച് ‘വൈറ്റ് അലേര്‍ട്ട്’ എന്ന പേരില്‍ പ്രതിഷേധം അറിയിക്കാനാണ് ഐഎംഎയുടെ ആഹ്വാനം. ചെന്നൈയിൽ ഡോക്ടറുടെ മൃതദേഹത്തോട് കാണിച്ച അനാദരവിലും പ്രതിഷേധം അറിയിക്കാനാണ് ഈ പ്രതിഷേധം.

#WATCH Delhi: Union HM Amit Shah & Union Health Minister Dr Harsh Vardhan interacted with Indian Medical Association doctors through video conferencing today. HM assured them security & appealed to them to not to do even symbolic protest as proposed by them, govt is with them. pic.twitter.com/kuiB8vsxWC

— ANI (@ANI) April 22, 2020"
https://malayalam.indianexpress.com/kerala-news/coronavirus-kerala-govt-employees-salary-cut-365837/,
https://malayalam.indianexpress.com/news/coronavirus-covid-19-news-live-updates-365788/,"കോവിഡ് പ്രതിരോധ പ്രവർത്തനങ്ങൾക്കായി മുൻനിരയിൽ നിന്നുകൊണ്ടുള്ള ഡോക്ടർമാരുടെ പോരാട്ടത്തിന് അഭിനന്ദനമറിയിച്ച് കേന്ദ്ര ആഭ്യന്തരമന്ത്രി അമിത് ഷാ. ഇന്ത്യന്‍ മെഡിക്കല്‍ അസോസിയേഷന്‍ പ്രതിനിധികളുമായും ഡോക്ടര്‍മാരുമായും വീഡിയോ കോണ്‍ഫറന്‍സ് വഴി സംസാരിക്കുകയായിരുന്നു അമിത് ഷാ. ആരോഗ്യ പ്രവര്‍ത്തകര്‍ക്ക് നേരെ നടന്ന അതിക്രമങ്ങള്‍ രാജ്യത്ത് ഒരുപാട് റിപ്പോര്‍ട്ട് ചെയ്തിരുന്നു. ഈ സാഹചര്യത്തിലാണ് ആരോഗ്യമന്ത്രി ഡോ. ഹർഷ് വർധനോടൊപ്പം ഷാ വീഡിയോ കോൺഫറൻസ് നടത്തിയത്. Read More

#WATCH Delhi: Union HM Amit Shah & Union Health Minister Dr Harsh Vardhan interacted with Indian Medical Association doctors through video conferencing today. HM assured them security & appealed to them to not to do even symbolic protest as proposed by them, govt is with them. pic.twitter.com/kuiB8vsxWC"
https://malayalam.indianexpress.com/news/coronavirus-very-likely-of-animal-origin-no-sign-of-lab-manipulation-who-365792/,Coronavirus Very Likely Of Animal Origin No Sign Of Lab Manipulation Who
https://malayalam.indianexpress.com/kerala-news/coronavirus-covid-19-kerala-high-alert-on-border-districts-365780/,
https://malayalam.indianexpress.com/kerala-news/coronavirus-kerala-latest-updation-new-cases-cm-pinarayi-vijayan-365718/,
https://malayalam.indianexpress.com/news/un-warns-on-hunger-as-coronavirus-cases-top-25-lakhs-365778/,
https://malayalam.indianexpress.com/social/covid-19-fake-news-cyber-dome-in-action-365677/,
https://malayalam.indianexpress.com/social/coronavirus-matterhorn-lit-up-with-indian-flag-to-show-solidarity-364769/,"ന്യൂഡൽഹി:ഇന്ത്യൻ പതാകയുടെ നിറമണിഞ്ഞ് സ്വിറ്റ്സർലൻഡിലെ മാറ്റർഹോൺ പർവതം. കോവിഡ് -19 രോഗ വ്യാപനത്തിനെതിരേ പോരാടുന്ന എല്ലാ ഇന്ത്യക്കാർക്കും ഐക്യദാർഢ്യം പ്രകടിപ്പിച്ചാണ് ആൽപ്സ് പർവത നിരയുടെ ഭാഗമായ മാറ്റർഹോണിൽ ത്രിവർണ പതാകയുടെ നിറത്തിലുള്ള പ്രകാശം പതിപ്പിച്ചതെന്ന് സ്വിറ്റ്സർലൻഡിലെ ഇന്ത്യൻ എംബസി അറിയിച്ചു. സ്വിറ്റ്സർലൻഡിലെ സെർമാറ്റിലാണ് മാറ്റർഹോൺ പർവതം. സെർമാറ്റ് ടൂറിസത്തിന് നന്ദി യറിയിക്കുന്നതാും സ്വിറ്റ്സർലൻഡിലെ ഇന്ത്യൻ എംബസി അറിയിച്ചു.

INDIAN TRICOLOR ON THE MATTERHORN MOUNTAIN: Indian Tricolor of more than 1000 meters in size projected on Matterhorn Mountain, Zermatt, Switzerland to express Solidarity to all Indians in the fight against COVID 19. A big Thank You to @zermatt_tourism for the gesture. @MEAIndia pic.twitter.com/y4diNDSlT9

— India in Switzerland, The Holy See & Liechtenstein (@IndiainSwiss) April 17, 2020"
https://malayalam.indianexpress.com/health/cancer-patients-do-not-panic-owing-to-the-coronavirus-outbreak-365668/,"ആഗോളതലത്തിൽ തന്നെ കൊറോണ വൈറസിനെ തുടർന്ന് വലിയ പ്രതിസന്ധി ഉടലെടുത്തിട്ടുണ്ട്. ഓരോ ദിവസവും സാഹചര്യങ്ങൾ മാറിമറിയുന്നു. ശ്വാസകോശ സംബന്ധമായ അസുഖങ്ങൾക്ക് കാരണമാകുന്ന വൈറസാണ് കോവിഡ്-19. ഗുരുതരമായ സാഹചര്യങ്ങളിൽ ഇത് ന്യൂമോണിയയിലേക്ക് നയിക്കും. ശ്വാസകോശ സംബന്ധമായ അസുഖം, പനി, ചുമ, ശ്വാസതടസ്സം, ശ്വസന ബുദ്ധിമുട്ടുകൾ തുടങ്ങിയ ലക്ഷണങ്ങൾ ഒരാൾ പ്രകടിപ്പിക്കുകയാണെങ്കിൽ അയാൾ / അവളിൽ കൊറോണ വൈറസ് ബാധിച്ചേക്കാം. വീട്ടിൽ സുരക്ഷിതമായി തുടരാനും മുൻകരുതലുകൾ എടുക്കാനും എല്ലാവരോടും നിർദേശിച്ചിരിക്കുന്നതിനാൽ, ലോക്ക്ഡൗൺ കാലയളവിൽ കാൻസർ രോഗികൾ തങ്ങളുടെ ആരോഗ്യം ശ്രദ്ധിക്കേണ്ടത് അത്യാവശ്യമാണ്.

”കാൻസർ രോഗികൾക്ക് കൊറോണ വൈറസ് ബാധിക്കാനുള്ള സാധ്യത കൂടുതലാണ്. വീട്ടിൽ നിന്ന് പുറത്തുപോകുന്നത് ഒഴിവാക്കുകയും ആവശ്യമായ എല്ലാ മുൻകരുതലുകളും സ്വീകരിക്കേണ്ടത് ഈ സമയത്തിന്റെ ആവശ്യകതയാണ്,” ഏഷ്യൻ കാൻസർ ഇൻസ്റ്റിറ്റ്യൂട്ട് ഓഫ് ഓൺകോളജിയിലെ സീനിയർ സർജിക്കൽ ഓൺകോളജിസ്റ്റ് ഡോ.ധൈര്യശീൽ സാവന്ത് പറഞ്ഞു.

കാൻസർ രോഗികൾ ചെയ്യേണ്ടത് എന്താണെന്നതിനെക്കുറിച്ച് ഡോ. സാവന്ത് പറയുന്നു.

ദിവസവും വ്യായാമം ചെയ്യുക

ശാരീരികമായി ആക്ടീവായിരിക്കാൻ വ്യായാമം അത്യാവശ്യമാണ്. വ്യായാമം ചെയ്തില്ലെങ്കിൽ ശരീരത്തിന്റെ പ്രവർത്തനം തകരാറിലാവുകയും പേശികളുടെ ബലഹീനതയ്ക്ക് കാരണമാവുകയും ചെയ്യും. അതിനാൽ, ദിവസേന വ്യായാമം ചെയ്യുന്നതിലൂടെ നിങ്ങളുടെ ബാലൻസ് മെച്ചപ്പെടുത്തുകയും വീഴ്ചയുണ്ടാകാനുളള സാധ്യത കുറയ്ക്കുകയും ചെയ്യാം. വ്യായാമം ചെയ്യുന്നതിലൂടെ ഓക്കാനം അല്ലെങ്കിൽ ഛർദ്ദി ഉണ്ടാകുന്നത് കുറയ്ക്കും. അതിലൂടെ, നിങ്ങൾക്ക് ഒപ്റ്റിമൽ ഭാരം നിലനിർത്താനും ക്ഷീണം തോന്നുന്നത് ഒഴിവാക്കാനും ജീവിത നിലവാരം ഉയർത്താനും കഴിയും.

Read Also: ലോക്ക്ഡൗൺ ദിനങ്ങളിലെ അമിതാഹാരം ഒഴിവാക്കാൻ ചില എളുപ്പ വഴികൾ

ഇതൊക്കെയാണെങ്കിലും ഏതെങ്കിലും വ്യായാമം തുടങ്ങുന്നതിനു മുമ്പ് ഡോക്ടറുമായി സംസാരിക്കുക. കാൻസറിന്റെ ഘട്ടത്തെ അടിസ്ഥാനമാക്കി ഒരു വ്യായാമം നിർദേശിക്കാൻ അവർക്ക് കഴിയും. നടത്തം, ലൈറ്റ് സ്ട്രെച്ചിങ്, യോഗ എന്നിവയാണ് നിങ്ങൾക്ക് വീട്ടിൽ ചെയ്യാൻ കഴിയുന്ന മറ്റ് വ്യായാമങ്ങൾ. എന്നാൽ കഠിനമായ വ്യായാമങ്ങൾ ചെയ്യുന്നത് ഒഴിവാക്കുക. വ്യായാമം ചെയ്യുമ്പോൾ വേദന തോന്നുന്നെങ്കിൽ ഉടൻ നിർത്തുക.

ആരോഗ്യകരമായ ഭക്ഷണം കഴിക്കുക



കാൻസർ രോഗികൾ വീട്ടിൽ തയ്യാറാക്കുന്ന ആരോഗ്യകരവും സമീകൃതവുമായ ഭക്ഷണക്രമം തിരഞ്ഞെടുക്കണം. അതോടൊപ്പം ഭക്ഷണത്തിൽ ആവശ്യമായ എല്ലാ പോഷകങ്ങളും ഉൾപ്പെടുത്തുക. ഇരുമ്പ്, കാൽസ്യം എന്നിവ അടങ്ങിയ തക്കാളി, കാരറ്റ്, മത്തങ്ങ പോലുളള പച്ചക്കറികളും ക്രൂസിഫറസ് പച്ചക്കറികളും (കാബേജ്, കോളിഫ്ളവർ, ബ്രൊക്കോളി) കഴിക്കുക. വാഴപ്പഴം, പീച്ച് പഴം, കിവീസ്, പിയർ പഴം, ഓറഞ്ച് തുടങ്ങിയവ കഴിക്കുന്നതിലൂടെ ആവശ്യമുള്ള വിറ്റാമിൻ സി നേടാനാവും. രോഗപ്രതിരോധ ശേഷി കൂട്ടാൻ ഭക്ഷണത്തിൽ ഇഞ്ചി, വെളുത്തുള്ളി, മഞ്ഞൾ എന്നിവ ചേർക്കുക. ധാരാളം വെള്ളം കുടിച്ച് ജലാംശം നിലനിർത്തുക.

മനസ്സിന്റെ ഉന്മേഷം നിലനിർത്തുക

സ്വയം ശാന്തമാകാൻ ധ്യാനം ചെയ്യാൻ ശ്രമിക്കുക. കൊറോണ വൈറസ് പൊട്ടിപ്പുറപ്പെട്ടതിനെ കുറിച്ചോർത്ത് പരിഭ്രാന്തരാകരുത്. കുടുംബാംഗങ്ങളുമായി ഫോണിൽ സംസാരിക്കുക. വായിക്കുക, എഴുതുക, സംഗീതം കേൾക്കുക, പൂന്തോട്ട പരിപാലനം തുടങ്ങി നിങ്ങൾക്ക് ഇഷ്ടപ്പെട്ട കാര്യങ്ങൾ ചെയ്യാൻ സമയം വിനിയോഗിക്കുക.

നിങ്ങളുടെ ഷെഡ്യൂൾ തയ്യാറാക്കുക

ഒരു ദിവസം നിങ്ങൾ ചെയ്യാൻ ഉദ്ദേശിക്കുന്ന കാര്യങ്ങൾ എന്തൊക്കെയെന്നുളള ലിസ്റ്റ് തയ്യാറാക്കുക. ഒരു ഡയറിയിൽ നിങ്ങളുടെ ചിന്തകളും വികാരങ്ങളും എഴുതുക.

മറ്റ് പ്രധാന കാര്യങ്ങൾ

> അസുഖമുള്ള ആളുകൾ നിങ്ങൾക്ക് ചുറ്റുമുണ്ടാകരുത് അല്ലെങ്കിൽ വീട്ടിൽ നിന്ന് പുറത്തുപോകരുത്

> വ്യക്തിഗത ശുചിത്വം പാലിക്കുക. നിങ്ങൾ പതിവായി സ്പർശിക്കുന്ന വസ്തുക്കൾ വൃത്തിയാക്കുക അല്ലെങ്കിൽ അണുവിമുക്തമാക്കുക

> നിങ്ങൾക്ക് കഴിയുന്നത്ര വിശ്രമിക്കുക

> കൈ കഴുകാതെ മുഖം, മൂക്ക് അല്ലെങ്കിൽ വായിൽ പോലും തൊടരുത്

> നിങ്ങളുടെ കുടുംബാംഗങ്ങൾക്ക് അസുഖമുണ്ടെങ്കിൽ, ചുമയോ തുമ്മലോ ഉളള സമയത്ത് അവർ വായ മൂടുന്നുവെന്ന് ഉറപ്പു വരുത്തുക. തുമ്മുകയോ ചുമയ്ക്കുകയോ ചെയ്യുമ്പോൾ നിങ്ങളും വായ മൂടണം. വീട്ടിൽ സന്ദർശകരെ നിയന്ത്രിക്കുക. തുമ്മുകയോ ചുമയ്ക്കുകയോ ചെയ്യുമ്പോൾ വായ മൂടാൻ ഉപയോഗിക്കുന്ന ടിഷ്യുകൾ നശിപ്പിച്ചു കളയുക. വീട്ടിൽ സാമൂഹിക അകലം പാലിക്കുക

> കിംവദന്തികളിൽ വിശ്വസിക്കരുത്. വിഷമകരമായ വാർത്തകൾ വായിക്കുന്നത് ഒഴിവാക്കുക

> മരുന്നുകൾ കൃത്യമായി കഴിക്കുക. ഡോക്ടറുമായി എപ്പോഴും സമ്പർക്കം പുലർത്തുക

Read in English: Precautions cancer patients can take to stay safe from coronavirus

Get all the Latest Malayalam News and Kerala News at Indian Express Malayalam. You can also catch all the Latest News in Malayalam by following us on Twitter and Facebook"
https://indianexpress.com/article/explained/kerala-coronavirus-cases-kasaragod-model-6371484/,"A look at the Kasaragod model, and how it differs from some of the other models across the country that have generated interest. (File Photo) A look at the Kasaragod model, and how it differs from some of the other models across the country that have generated interest. (File Photo)

Coronavirus (COVID-19): Kerala has bucked the national trend for novel coronavirus disease (COVID-19) with a doubling time of 72.2 days — which means that the number of cases in the state doubled in that many days — against a national average of 7.5 days. Last week, the Centre showcased the contact tracing and containment model of Kerala’s Kasaragod, one of the earliest spots on India’s COVID-19 map, as one of the success stories of the containment exercise.

A look at the Kasaragod model, and how it differs from some of the other models across the country that have generated interest.

Coronavirus: Why showcase Kasaragod?

Kasaragod reported the third case of COVID-19 in the country — a student airlifted from Wuhan on February 3. The district administration mounted a massive exercise to trace the 150-odd contacts of that one student.

Read| Fight against COVID-19: Behind Kerala’s flattening curve, involvement of community

According to figures uploaded by the Kerala government, Kasaragod has had 169 cases and zero deaths until April 19, a unique achievement in itself, given the fact that a large proportion of the district’s population have settled abroad. Of those infected, 123 people have recovered so far, leaving only 46 active cases among the original 169.

Data source: Government of Kerala

In the initial days of the epidemic, almost all index cases were people who had caught the virus during their travels abroad (about 15.38%). The second wave in the district happened after people started coming back from the Middle East from March 16.

Kasaragod: Under what circumstances was this containment achieved?

The district is far from major cities, so that the isolation exercise was smoother. Kasaragod is Kerala’s northernmost district, far away from capital Thiruvananthapuram. However, this distance also presented an additional challenge. When expatriates returned in large groups, they landed in various airports and took various public transport options — railways, road etc — to reach home, which had the potential to leave contacts all along the way.

Health Ministry officials said that while Kasaragod has been showcased, the success of Kerala as a whole is a story essentially of the strength of the state’s healthcare system rather than one of the immediate measures taken. “It is not for nothing that it leads in all human development indices. The most amazing thing about Kerala is how receptive they are of suggestions for improvement,” said a senior official in the Health Ministry.

What is the Kasaragod model?

The district administration relied on aggressive testing, technology, foolproof contact tracing, and an effective public awareness campaign on social distancing to achieve the results it can now show. In Kasaragod, as in other districts, the state government appointed a special officer to coordinate functioning of the district administration and for effective coordination between line departments at field and secretariat levels. Section 144 was imposed in the entire district, with seven drones employed for surveillance. Under the Care for Kasaragod initiative, a detailed action plan — common coordinated action plan — was drawn up for combating COVID-19 so that all stakeholders could turn to it when the situation arose.

And what was this action plan?

All quarantined people were tracked using GPS. All essentials were home-delivered in the containment/cluster zones, irrespective of whether they were rich or poor. A campaign on social distancing called “Break the Chain” was carried out to deliver the message of social distancing. Core teams were formed with incident commanders to rush to various areas and take quick action.

📣 Express Explained is now on Telegram. Click here to join our channel (@ieexplained) and stay updated with the latest

The plan was carried out with a very strong social welfare component, which included free food kits for the poor and migrant workers, a strong check on hoarding and black-marketing, and health checkup on alternate days for migrants or the destitute. Community kitchens supplied free food. Jana Jagratha Samitis at the ward level ensured that the messaging reached every person.

What was the scale of the exercise?

A total of 17,373 people were quarantined. On an average, 100-150 samples were tested every day and new testing labs were started. The medical college in Kasaragod with 200 beds and an ICU facility was operationalised in four days. There is also a 709-bed COVID-19 care centre. ASHAs and health inspectors carried out household surveys.

All primary and secondary contacts of high-risk cases (those aged 60 or above) were quarantined in isolation centres. This was done as many homes did not have separate toilets.

What are the other successful models containment?

In a recent meeting, the Centre asked district magistrates to draw up separate crisis plans for COVID-19 management, and shared several models. These include Agra, Bhilwara, Pathanamthitta etc.

AGRA MODEL: Under the cluster containment and outbreak containment plan in Agra, the district administration identified epicentres, delineated the impact of positive confirmed cases on the map, and deployed a special task force as per a micro plan made by the district administration. The hotspots were managed through an active survey and containment plan. The “hotspot” area was identified within a radius of 3 km from the epicentre, while a 5 km buffer zone was identified as the containment zone.

BHILWARA MODEL: This entailed complete isolation of Bhilwara city with Section 144 CrPC being imposed. In the first phase, essential services were allowed; in the second phase, the shutdown was total with the city and district borders sealed and checkposts at every entry and exit point. Trains, buses and cars were stopped. The district magistrates of neighbouring districts too were asked to seal their borders. The message from Bhilwara was “ruthless containment”.

PATHANAMTHITTA MODEL: Kerala deployed technology to a large extent in the Pathanamthitta model too. Every person who had entered the district was screened and a database created so that they could be reached at short notice. Graphics were created showing the travel route of the positive cases and publicised. This led to self-reporting. As people realised from the route maps and the travel times that they had come in contact with someone positive for COVID-19, many walked up to be screened or treated.

Don’t miss these articles on Coronavirus from the Explained section:

‣ How coronavirus attacks, step by step

‣ Mask or no mask? Why the guidance has been shifting

‣ Besides a face cover, should I wear gloves when I go outdoors?

‣ How the Agra, Bhilwara and Pathanamthitta Covid-19 containment models differ

‣ Can coronavirus damage your brain?

📣 The Indian Express is now on Telegram. Click here to join our channel (@indianexpress) and stay updated with the latest headlines

For all the latest Explained News, download Indian Express App."
