url,text
https://indianexpress.com/article/cities/pune/pune-asymptomatic-coroanvirus-patients-hospitals-6373126/,"Swab testing facility will be set up at Cadbury Junction and Kalwa Naka through Infection Labs. This facility will enable the citizens to go to any lab for swab testing and test the corona in the allotted time after online registration. (Express photo) Swab testing facility will be set up at Cadbury Junction and Kalwa Naka through Infection Labs. This facility will enable the citizens to go to any lab for swab testing and test the corona in the allotted time after online registration. (Express photo)

In a bid to ease pressure on hospitals, Pune district authorities are considering a move to reserve hospital beds for critically-ill COVID-19 patients while accommodating those who have tested positive but are asymptomatic to a simple hospice-like facility. “We are even thinking of discharging them after a week or so,” District Collector Naval Kishore Ram told The Indian Express.

On Tuesday, a meeting — chaired by Dr Subhash Salunkhe, chairman of the Communicable Diseases Prevention and Control Technical Committee — with senior personnel from various private hospitals was held at B J Medical College to take note of their grievances, and issues they are facing while treating COVID-19 patients.

“These are extraordinary times and my appeal to private hospitals is to bear the treatment cost for a while. On the lines of treatment provided to H1N1 virus (swine flu) patients… when the reimbursement was done after the review by experts, we are also working out a similar policy move on the issue,” Ram said. There is a need to utilise COVID care centres, where, based on the doctor’s advice, those who have tested positive but have mild symptoms can be kept under observation, said district authorities.

Dr Salunkhe said a committee has been set up to look into the issues of providing remuneration to private hospitals for treating COVID-19 patients. He also pointed out that those who have tested positive with COVID-19 but are in the ‘C’ category of patients, with mild symptoms, do not require to be admitted to hospitals but can be placed in COVID care centres. “Private hospitals need to reserve more beds for those who require intervention, oxygenation and for critically-ill COVID-19 patients,” Dr Salunkhe said.

Urging hospitals not to turn away patients, he said, “There have been reports of big hospitals turning away patients as they did not have sufficient beds, but that should no longer be the case. We must ensure that such situations do not arise.”

According to district administration officials, if a flu/fever clinic identifies that a person is not critical but has COVID-19 symptoms, he or she should be sent to COVID care centre after taking their swab samples. “We are taking inputs from private hospitals… and taking help of technology to identify area-wise hospitals where patients can be sent,” said an official.

At Ruby Hall Clinic, which has done screening of its staff and detected 27 of them positive with COVID-19, medical director Dr Sanjay Pathare, who attended the meeting, said a majority of them were carriers. “However, they are asymptomatic and do not require hospitalisation,” he said.

In Pune, over 800 persons have tested positive for COVID-19 and a majority of them are admitted in Symbiosis International Hospital, Bharati Hospital and Sassoon General Hospital. Dr Sanjay Lalwani, medical director at Bharati Hospital, said at least 12 hospitals with 50 ICU beds should be identified along with another 10 to 12 hospitals with 25 ICU beds so that “intensive care treatment can be made immediately available”. He added, “Cases need to be picked up early and referred to appropriate hospitals with a dedicated team of super specialists.”

“Hospitals are staring at a financial loss and we need to ensure providing personal protective equipment to our staff,” said Dr H K Sale, executive director at Noble Hospital.

Dr Sunil Rao, group medical director at Sahyadri Specialty hospital, suggested that daily remuneration to the tune of Rs 35,000 and Rs 15,000 could be given for a critical COVID-19 patient and non-critical patient, respectively.

Meanwhile, after two private hospitals denied treatment to a 40-year-old suspected COVID-19 patient, Sassoon Hospital sent him to Symbiosis Hospital, where he is on intensive care.

Dr Vijay Natarajan, CEO at Symbiosis hospital, said, “He was admitted to our hospital at 9 pm on Sunday and the swab tested positive for COVID-19 on Monday. He is on intensive care and all four ventilators are now occupied at the hospital.” Dr Natarajan added that patients with severe acute respiratory illness should not be denied treatment just because of the possibility of being a suspected COVID-19 patient.

On April 18, a 76-year-old woman had died of cardiac arrest. Her family members claimed two large hospitals refused to admit her after her chest X-ray had a pneumonia patch. “From 3 pm to 6 pm, I was in an ambulance seeking treatment for my mother. She died on the way to a third hospital,” the woman’s son told The Indian Express.

📣 The Indian Express is now on Telegram. Click here to join our channel (@indianexpress) and stay updated with the latest headlines

For all the latest Pune News, download Indian Express App.

© The Indian Express (P) Ltd"
https://indianexpress.com/article/cities/pune/coronavirus-outbreak-two-women-in-their-50s-succumb-to-infection-pune-toll-54-6373104/,"At Sassoon General Hospital, authorities said the total number of deaths were 43. (Representational) At Sassoon General Hospital, authorities said the total number of deaths were 43. (Representational)

A 52-year-old woman from Taljai died of respiratory failure linked to coronavirus on Tuesday, while Sassoon General Hospital registered the death of a COVID-19 patient, a 57-year-old woman from Kondhwa, on Monday. With the two deaths in two days, the death toll in Pune has risen to 54.

The 52-year-old woman was admitted to Deenanath Mangeshkar Hospital on April 19 and had hypertension, said Dr Sanjeev Wavare, assistant medical officer of health at Pune Municipal Corporation. She passed away on Tuesday due to COVID-19-related complications.

At Sassoon General Hospital, authorities said the total number of deaths were 43. The 57-year-old woman from Kondhwa was admitted on April 19 and she had co-morbidities like diabetes. While she died on at 2.20 pm on Monday, the swab sample taken from her tested positive hours later, on Monday night.

Currently, there are 107 patients at Sassoon General Hospital, of which 21 require constant oxygen support.

A total of 813 cases have been detected with COVID-19 and on Tuesday, a total of 57 new COVID-19 patients were reported till 7 pm, said Dr Bhagwan Pawar, district health officer. Meanwhile, Ramchandra Hankare, chief medical officer of PMC, said a total of 87 persons have recovered and been discharged so far.

📣 The Indian Express is now on Telegram. Click here to join our channel (@indianexpress) and stay updated with the latest headlines

For all the latest Pune News, download Indian Express App."
https://indianexpress.com/article/cities/lucknow/covid-19-up-police-station-turns-marriage-venue-6374074/,"The decision to hold the wedding at the police station was taken just a couple of days before the event. (Representational image) (Source: Getty/Thinkstock) The decision to hold the wedding at the police station was taken just a couple of days before the event. (Representational image) (Source: Getty/Thinkstock)

Anil and Jyoti will always remember how they began their married lives – walking out of a police station in the midst of a lockdown against a virus. Their marriage ceremony took place Monday on the premises of Dheena police station in Uttar Pradesh’s Chandauli district.

Anil, who is from Mahuji village in Chandauli district, and Jyoti from Ghazipur district tied the knot at a Shiva temple located inside the police station complex. “It was a marriage with limited means and five people each from the groom’s side and from the bride’s side were present during the ceremony,” SHO Rajesh Kumar told PTI.

Police were returning a favour to the couple. Anil had helped them during a boat tragedy in February, saving several people from drowning. His role was lauded by senior officials of the police and the district administration.

“Anil’s marriage with Jyoti was already fixed for April 20. However, the imposition of the nationwide lockdown and its subsequent extension worried him. He then contacted us and sought a solution,” the SHO said.

Police reminded him about the restrictions on gatherings. “Anil then asked us whether his marriage could be solemnised at the Shiva temple inside the police station compound,” Kumar said.

He assured police that only five people from each side will take part in the ceremony. “On this condition, we gave our nod,” Kumar said.

The decision to hold the wedding at the police station was taken just a couple of days before the event. Senior police officials including the additional superintendent of police, circle officer and in-charge of a police outpost were present during the marriage.

“The event, though with limited means, was solemnised amidst the chanting of Vedic mantras, while strictly adhering to social distancing norms,” the police officer said. “Unlike the usual time-consuming, elaborate rituals in Hindu marriages, this marriage was relatively shorter,” he added.

📣 The Indian Express is now on Telegram. Click here to join our channel (@indianexpress) and stay updated with the latest headlines

For all the latest Lucknow News, download Indian Express App."
https://indianexpress.com/article/cities/chennai/covid-19-at-least-25-people-of-tamil-news-channel-test-positive-in-chennai-6372444/,"The first case from the channel was reported on Monday. The first case from the channel was reported on Monday.

A total of 27 journalists who worked with a Tamil TV channel have tested positive for Covid-19 till Tuesday. A senior official representing the Tamil Nadu Directorate of Public Health confirmed that all of them have been isolated in government facilities in Chennai and are receiving treatments.

According to the official, the first case from the channel was reported on Monday. “Immediately, we had taken steps to test a total of 92 more employees who worked there. When results came on Tuesday, 26 of them turned positive. We have already isolated them and their secondary contacts are being traced now,” the official said.

Meanwhile, the managing director of the channel said they couldn’t have prevented this at a time when many reporters were bringing reports from the ground. “At this point, it is our responsibility to cooperate with the state and Centre in measures being taken to fight this pandemic. We will not try to run the channel risking many lives. That will not be appropriate… We promise that we will work along with the government and follow further directions. We will come back soon with the entire strength and more reports,” he said.

📣 The Indian Express is now on Telegram. Click here to join our channel (@indianexpress) and stay updated with the latest headlines

For all the latest Chennai News, download Indian Express App.

© The Indian Express (P) Ltd"
https://indianexpress.com/article/cities/hyderabad/coronavirus-lockdown-cant-fee-hike-in-2020-21-telangana-govt-orders-private-schools6372975/,"The order has warned the schools of cancellation of their recognition, apart from legal action, in case of non-compliance. The order has warned the schools of cancellation of their recognition, apart from legal action, in case of non-compliance.

The Telangana government Tuesday ordered private schools to not hike fee for the academic year 2020-21 and warned them of cancellation of their recognition and No Objection Certificate for affiliation, apart from legal action, in case of non-compliance.

The government order issued by Special Chief Secretary Chitra Ramachandran applies to all private unaided recognized schools in the state, which are affiliated to State Board, CBSE, ICSE, and other international boards. They have been asked, “to charge only tuition fees every month until further orders”.

The order came the State Cabinet’s decision in this regard on April 19 considering the hardships faced by parents due to the ongoing Covid-19 lockdown. Following the order, Commissioner for School Education, Ch Ramana Kumar, issued directions for creation of a call centre for grievances between 10 a.m. and 5 p.m. on all working days. He also urged disposal of the complaints within 24 hours after duly verifying from field officers.

After such orders were issued by states like Delhi, Uttar Pradesh, Haryana, Punjab, and Tamil Nadu, etc. several people had taken to Twitter tagging municipal administration and IT minister KT Rama Rao with similar requests.

Though the decision has come in the backdrop of a COVID pandemic, the latest order has come as a major relief for members of the Hyderabad School Parents Association(HSPA) whose fight against school fee hike is nearly a decade-long.

Thanking chief minister K Chandrasekhar Rao, a statement from HSPA said: “While we have no doubts concerning the noble intention of the government and the Chief Minister, we are unable to ignore the previous bitter experience wherein similar orders issued by the government were waylaid by the powerful lobby of schools and our never-ending judicial process.”

They were referring to an order dated January 4, 2018, ordering schools to withhold fee hikes for the academic year 2018-19. According to HSPA members, the government order was challenged by the school management in the Court and a stay order was granted. The High Court finally heard the HSPA’s case after two full years in March 2020 and

ordered the Government to come up with a comprehensive policy on School fee regulation by April 9, 2020, they said.

HSPA vice-president Seema told indianexpress.com that the court has ordered the schools to deposit the amount of hiked fee from the year 2018 in separate bank accounts and prevented any use of the same. “More than half of the schools have already collected the fee. Some schools have communicated with parents that the excess fee collected

will be adjusted in fee for later months. We want the government to clarify on this without leaving it to individual schools to take such decisions,” she said.

As much as the HSPA welcomes the latest order, it says it needs to be backed with the needed legal strength to prevent judicial intervention. The government has to come out soon with a comprehensive policy for school fee regulation – as has been ordered by the High Court of Telangana

📣 The Indian Express is now on Telegram. Click here to join our channel (@indianexpress) and stay updated with the latest headlines

For all the latest Hyderabad News, download Indian Express App.

© IE Online Media Services Pvt Ltd"
https://indianexpress.com/article/cities/hyderabad/tiss-hyderabad-socio-economic-survey-migrants-coronavirus-6364241/,"Rachakonda Police Commissioner Mahesh Bhagwat said as part of the continuous efforts to ensure that people in distress, especially migrant workers, the police department have made elaborate arrangements for the supply of food. (Express Photo by Arul Horizon) Rachakonda Police Commissioner Mahesh Bhagwat said as part of the continuous efforts to ensure that people in distress, especially migrant workers, the police department have made elaborate arrangements for the supply of food. (Express Photo by Arul Horizon)

In order to address the needs of the migrant workers stuck in the city due to the extension of nationwide lockdown, Rachakonda police in Telangana has collaborated with the Tata Institute of Social Sciences (TISS-Hyderabad) to conduct a socio-economic profiling and need assessment survey of workers.

On Wednesday, a team of six faculty members from TISS-Hyderabad, along with volunteers from the Rachakonda Security Council (RKSC), surveyed 132 households/groups with a total population of 496 people in Shanti Nagar within Jawahar Nagar police station limits. Natives of Jharkhand, Chattisgarh, Bihar, Tamil Nadu, Andhra Pradesh, and West Bengal, etc in these clusters.

Calling migrant laborers the underbelly of the Indian economy, Professor U Vindhya, Deputy Director of TISS-Hyderabad, said the absence of any data on them is what led to the idea of taking up a rapid need assessment. Speaking to indianexpress.com, Professor Vindhya said, “There is a dearth of data on the plight of migrant laborers from all over India. We thought we could make a beginning by doing a quick survey of different migrant groups in Hyderabad.”

The broad framework of their survey is the socio-economic inequality and disadvantage in society. “But we are not going into all their needs but doing a rapid need assessment so that we can prepare a set of concrete recommendations for the government,” she added.

The survey has 35 questions, seeking information about their occupation, housing conditions, their most important current needs, and also what that they would like from the government, be it just food, money, or the certainty of their job post lockdown. There are also questions to find out the status of their indebtedness, if they send money home, etc. Finally, it also tries to find out what kind of relief has been distributed to them so far.

Rachakonda Police Commissioner Mahesh Bhagwat said as part of the continuous efforts to ensure that people in distress, especially migrant workers, the police department have made elaborate arrangements for the supply of food and other relief materials in its jurisdiction. While relief materials such as cooked food, groceries, and medical facilities are reaching the people, many other social parameters are emerging out of anxiety among these sections of people, he said in a statement.

On the survey, he said the enumeration of this data can further strengthen the current efforts of Rachakonda Police in plugging gaps and avoiding duplication of services.

On April 14, hours after the PM’s address on extending the lockdown, over 120 migrant workers were found walking from Hyderabad to Srikakulam in Andhra Pradesh, and were sent back to their shelters after state minister Talasani Srinivas Yadav, Uppal MLA Subhash Reddy and other officials intervened and stopped them near Uppal. Groups of migrants were also stopped and sent back from Pathangi, Radhika crossroads, RK Puram, and Charminar.

The Telangana Government has also announced Rs 500 and 12 kg rice to migrant workers.

Don’t miss these articles on Coronavirus from the Explained section:

‣ How coronavirus attacks, step by step

‣ Mask or no mask? Why the guidance has been shifting

‣ Besides a face cover, should I wear gloves when I go outdoors?

‣ How the Agra, Bhilwara and Pathanamthitta Covid-19 containment models differ

‣ Can coronavirus damage your brain?

📣 The Indian Express is now on Telegram. Click here to join our channel (@indianexpress) and stay updated with the latest headlines

For all the latest Hyderabad News, download Indian Express App.

© IE Online Media Services Pvt Ltd"
https://indianexpress.com/article/cities/hyderabad/hyderabad-two-arrested-for-assaulting-doctor-in-covid-19-isolation-ward-6364059/,"Hyderabad: Hospital staff outside the special isolation ward set up for coronavirus in Hyderabad. (Photo: PTI) Hyderabad: Hospital staff outside the special isolation ward set up for coronavirus in Hyderabad. (Photo: PTI)

Two persons have been arrested in Hyderabad Wednesday for assaulting a doctor at Osmania General Hospital. The duo – Md Ashfaq and Md Arshad Ali – were booked under sections 332, 188, 269, 270, 271 of IPC and section 3 of the Epidemic Disease Act, 1897 and section 4 of Telangana Medicare Service Person and Medicare Service Institution Act, 2008. The duo was produced before the magistrate and remanded in judicial custody, said the police.

Read | With lockdown stressing out the mind, Hyderabad sets up an all-India helpline

In a statement, the Commissioner of Police Anjani Kumar warned that any person assaulting a doctor would be arrested and sent to jail immediately. He said Hyderabad City police is committed to taking prompt action against any person who assaults a doctor or any medical staff in any of the hospitals. In these challenging times, doctors

and the entire medical staff are true leaders of the society.

The incident took place on Tuesday afternoon when attendants of a person awaiting results of COVID-19 tests at the isolation ward of Osmania General Hospital assaulted the junior doctor on duty insisting that their kin be discharged immediately. This was following results of two other patients in the ward which came positive. They feared that those admitted in the ward may contract the infection from those tested positive for coronavirus.

Also Read | With over 250 COVID-19 cases, Hyderabad becomes cause for concern for Telangana

A few days ago, on April 1, a resident doctor in Gandhi hospital was assaulted by kin of a COVID-19 patient upon hearing about the patient’s demise. The kin too tested positive for the disease and are undergoing treatment in the ward. Police had arrested Abdul Khader (23).

Don’t miss these articles on Coronavirus from the Explained section:

‣ How coronavirus attacks, step by step

‣ Mask or no mask? Why the guidance has been shifting

‣ Besides a face cover, should I wear gloves when I go outdoors?

‣ How the Agra, Bhilwara and Pathanamthitta Covid-19 containment models differ

‣ Can coronavirus damage your brain?

📣 The Indian Express is now on Telegram. Click here to join our channel (@indianexpress) and stay updated with the latest headlines

For all the latest Hyderabad News, download Indian Express App.

© IE Online Media Services Pvt Ltd"
