url,text
https://indianexpress.com/article/india/indian-express-covid-19-tracker-india-state-wise-country-wise-cases-deaths-and-recovered-6368348/,"Maharashtra is the worst-affected states with more than 210 deaths and over 3600 cases. (Express Photo by Tashi Tobgyal) Maharashtra is the worst-affected states with more than 210 deaths and over 3600 cases. (Express Photo by Tashi Tobgyal)

Indian Express COVID-19 Tracker: The number of confirmed COVID-19 cases in India on Tuesday crossed the 18,000-mark to stand at 18,601. Of these, 14,759 are active and 3,251 are cured. At least 590 deaths have been reported in the country.

The first coronavirus case in India was reported on January 30, 2020. To combat the spread of the virus, Prime Minister Narendra Modi, on March 24 imposed a nationwide lockdown — world’s largest — for three weeks, which was subsequently extended till May 3. Provisions of the Epidemic Diseases Act, 1897 has been invoked across the states.

Maharashtra is the worst-affected states with more than 230 deaths and over 4,500 cases. As per the ministry, there is no community transmission in India yet. The Union Health Ministry said that the doubling time for COVID-19 cases in India had risen to 6.2 days over the past week, as compared to three days before the nationwide lockdown began on March 25.

Coronavirus (COVID-19) Total Cases Tally in India State Wise Breakdown

States Confirmed cases Recoveries Deaths Andaman and Nicobar Islands 16 11 0 Andhra Pradesh 722 92 20 Arunachal Pradesh 1 0 0 Assam 35 19 1 Bihar 113 42 2 Chandigarh 26 13 0 Chhattisgarh 36 25 0 Delhi 2081 431 47 Goa 7 7 0 Gujarat 1939 131 71 Haryana 254 127 3 Himachal Pradesh 39 16 1 Jammu and Kashmir 368 71 5 Jharkhand 46 0 2 Karnataka 408 112 16 Kerala 408 291 3 Ladakh 18 14 0 Madhya Pradesh 1485 127 74 Maharashtra 4666 572 232 Manipur 2 2 0 Meghalaya 11 0 1 Mizoram 1 0 0 Nagaland 0 0 0 Odisha 74 24 1 Puducherry 7 3 0 Punjab 245 38 16 Rajasthan 1576 205 25 Tamil Nadu 1520 457 17 Telangana 873 190 23 Tripura 2 1 0 Uttarakhand 46 18 0 Uttar Pradesh 1184 140 18 West Bengal 392 73 12

(The list was last updated on April 21 at 10.00 am. All details have been sourced from the Ministry of Health and Family Welfare and state health bulletins)

Coronavirus (COVID-19) cases across the globe:

Globally, 170,368 deaths have been reported so far. While a total of 2,478,173 confirmed cases have been reported from across the globe with the US reporting the highest number of cases at 787,752 followed by Spain (200,210), Italy (181,228), France (156,493) and Germany (147,065).

Country Cases Recovered Deaths US 787,752 72,826 42,359 Spain 2,00,210 80,587 20,852 Italy 1,81,228 48,877 24,114 France 1,56,493 38,037 20,265 Germany 1,47,065 95,200 4,862 UK 1,25,856 446 16,509 China 83,849 77,775 4,512 Iran 83,505 59,273 5,209 Turkey 90,980 13,430 2,140 Belgium 39,983 8,895 5,828

President Donald Trump said on Monday he will suspend all immigration into the United States temporarily through an executive order in response to the coronavirus outbreak and to protect US jobs.

(The list was last updated on April 20 at 10.00 pm. All details have been sourced from the John Hopkins University)

Don’t miss these articles on Coronavirus from the Explained section:

‣ How coronavirus attacks, step by step

‣ Mask or no mask? Why the guidance has been shifting

‣ Besides a face cover, should I wear gloves when I go outdoors?

‣ How the Agra, Bhilwara and Pathanamthitta Covid-19 containment models differ

‣ Can coronavirus damage your brain?

📣 The Indian Express is now on Telegram. Click here to join our channel (@indianexpress) and stay updated with the latest headlines

For all the latest India News, download Indian Express App.

© IE Online Media Services Pvt Ltd"
https://indianexpress.com/article/cities/delhi/covid-19-positive-cop-alleges-lack-of-hygiene-at-hospital-6373330/,"The man added his family has not been tested yet. “I request the authorities to take me to a private hospital. I have a Central Government Health Scheme (CGHS) card.” (Representational Image) The man added his family has not been tested yet. “I request the authorities to take me to a private hospital. I have a Central Government Health Scheme (CGHS) card.” (Representational Image)

A Delhi Police constable who tested positive for COVID-19 Saturday shared a video on social media complaining of lack of hygiene and healthcare in the hospital where he is being treated.

The constable was posted at Tilak Vihar police post, which comes under West Delhi’s Tilak Nagar. A senior police officer said a group of policemen were tested Friday at a DDY dispensary in Tilak Vihar. A day later, the constable tested positive. He was shifted to Chaudhary Brahm Prakash Ayurved Charak Sansthan, a designated COVID hospital in Dwarka.

On Tuesday, the constable shared a video online. He said, “This place is unhygienic. Over 20 patients, who are being treated on the same floor, share a common bathroom. If anyone complains of fever or throat pain, the hospital staff doesn’t give them medicines.” The constable also alleged that patients are not provided with hot water, sanitisers, handwash and proper bedding. “This pillow has black stains all over it. The staff doesn’t change the sheets and pillows.”

The man added his family has not been tested yet. “I request the authorities to take me to a private hospital. I have a Central Government Health Scheme (CGHS) card.”

DCP (West) Deepak Purohit said, “We will take care of the well-being of our staff and their family. We are following guidelines issued by Indian Council of Medical Research. We have sent hand sanitisers and kettles to the constable.” Senior police officers in Dwarka said they visited the hospital and met the staff. An officer said, “We spoke to their administration to check the cleanliness of the pillow and toilet.”

Police sources also said later on Tuesday, DCP (Dwarka) met the hospital director and all concerns of the policeman have been addressed. The hospital was unreachable for a comment.

Don’t miss these articles on Coronavirus from the Explained section:

‣ How coronavirus attacks, step by step

‣ Mask or no mask? Why the guidance has been shifting

‣ Besides a face cover, should I wear gloves when I go outdoors?

‣ How the Agra, Bhilwara and Pathanamthitta Covid-19 containment models differ

‣ Can coronavirus damage your brain?

📣 The Indian Express is now on Telegram. Click here to join our channel (@indianexpress) and stay updated with the latest headlines

For all the latest Delhi News, download Indian Express App."
https://indianexpress.com/article/cities/delhi/for-first-time-since-march-active-coronavirus-cases-dip-in-capital-6373313/,"On Sunday, the total active cases was 1,668. It fell to 1,603 on Monday and further to 1,498 on Tuesday. While 180 people recovered on Tuesday, 75 fresh cases were reported. On Sunday, the total active cases was 1,668. It fell to 1,603 on Monday and further to 1,498 on Tuesday. While 180 people recovered on Tuesday, 75 fresh cases were reported.

The number of active COVID-19 cases fell for the first time in the national capital since the first case was recorded in the second week of March.

On Sunday, the total active cases was 1,668. It fell to 1,603 on Monday and further to 1,498 on Tuesday. While 180 people recovered on Tuesday, 75 fresh cases were reported. It is also after two weeks that Delhi did not see a single COVID-19 death. Delhi has seen 47 deaths owing to the disease so far.

“The figures are enthusing. We hope to maintain the trend of having more recoveries than fresh cases for another month. This shows social distancing is working. We saw a sudden spike in cases in the second week of April. Many of those admitted to hospitals before that have been recovering and are being discharged. If the number of fresh cases continues to dip for another two weeks, we will be in a much stronger position,” said a senior government official who did not want to be named.

Read | June, July will test resolve: Top official in Covid battle

On Tuesday, the Delhi government added three more containment zones – parts of Devli Extension, Harsh Vihar in Hari Nagar Extension, and Krishna Puri in Mandawali – taking the total number of zones to 87. Daily house-to-house surveillance and sanitisation is being carried out in these areas. Close to 3.25 lakh people live in these containment zones.

Don’t miss these articles on Coronavirus from the Explained section:

‣ How coronavirus attacks, step by step

‣ Mask or no mask? Why the guidance has been shifting

‣ Besides a face cover, should I wear gloves when I go outdoors?

‣ How the Agra, Bhilwara and Pathanamthitta Covid-19 containment models differ

‣ Can coronavirus damage your brain?

📣 The Indian Express is now on Telegram. Click here to join our channel (@indianexpress) and stay updated with the latest headlines

For all the latest Delhi News, download Indian Express App."
https://indianexpress.com/article/india/india-moves-to-procure-more-covid-19-test-kits-from-korean-firms-6373230/,"Over the past few weeks, several Indian agencies and private companies have sourced 4.5 lakh testing kits from South Korea. Over the past few weeks, several Indian agencies and private companies have sourced 4.5 lakh testing kits from South Korea.

With Chinese testing kits having come under the scanner, India is stepping up procurement and production of testing kits from South Korean companies.

Officials on Tuesday said that a South Korean company has agreed to make and supply 5 lakh rapid antibody testing kits at its facility in Manesar, Haryana.

India’s ambassador to South Korea Sripriya Ranganathan visited the firm’s — SD Biosensor — facility in north Chungcheong province in South Korea and has tied up the arrangements.

The company has decided to manufacture these kits in a week, and will make more in the next few weeks.

This comes as the Indian Council of Medical Research (ICMR) on Tuesday advised states not to use the testing kits for the next two days, stating that it will issue an advisory after medical teams carry out field validation of the kits.

Read | ‘Consider pandemic extinguished only when it subsides worldwide’

Besides, India is procuring another 5 lakh coronavirus testing kits from South Korea to meet their growing demand in view of rising cases of the infection.

The Indian embassy in Seoul inked a deal with South Korean pharma giant Humasis Ltd to procure the kits, sources said. The company is sourcing raw materials for production of the testing kits from India, officials said.

Explained | To do rapid tests, or not to

Over the past few weeks, several Indian agencies and private companies have sourced 4.5 lakh testing kits from South Korea.

India has received 6.5 lakh testing kits from China last week. Sources said India is also also looking at procuring medical equipment, including testing kits from the UK, the US, France, Japan, Malaysia and Germany.

Don’t miss these articles on Coronavirus from the Explained section:

‣ How coronavirus attacks, step by step

‣ Mask or no mask? Why the guidance has been shifting

‣ Besides a face cover, should I wear gloves when I go outdoors?

‣ How the Agra, Bhilwara and Pathanamthitta Covid-19 containment models differ

‣ Can coronavirus damage your brain?

📣 The Indian Express is now on Telegram. Click here to join our channel (@indianexpress) and stay updated with the latest headlines

For all the latest India News, download Indian Express App."
https://indianexpress.com/article/explained/coronavirus-numbers-april-22-explained-6373577/,"Coronavirus (COVID-19): By Tuesday night, the total number of positive cases in the country had reached 19,975. Coronavirus (COVID-19): By Tuesday night, the total number of positive cases in the country had reached 19,975.

Coronavirus (COVID-19): Maharashtra added another 552 novel Coronavirus patients on Tuesday, taking the country within touching distance of 20,000 cases. The day also saw at least 52 deaths being reported from across the states, the highest the country has seen in a single day since the start of the outbreak.

By Tuesday night, the total number of positive cases in the country had reached 19,975. Maharashtra, with 5218 cases, accounted for more than a quarter of that number.

State (Top 10) Total Number of Cases New Cases on Tuesday Maharashtra 5218 552 Gujarat 2178 239 Delhi 2156 75 Rajasthan 1672 159 Tamil Nadu 1596 76 Madhya Pradesh 1552 67 Uttar Pradesh 1337 153 Telangana 928 56 Andhra Pradesh 757 35 Kerala 426 19

Tuesday happened to be the third straight day when Maharashtra contributed more than one-third of all the new Coronavirus cases reported in the country. On Sunday too, the state had added 552 cases, while on Monday 466 new cases had emerged in the state.

A total of 1510 new infections were reported from across the country on Tuesday, the second-highest single day increase since the virus began to spread in India in the first week of March. The biggest increase had come on Sunday, when 1577 new cases had emerged. Other major contributors to Tuesday’s increase were Gujarat, which reported 239 fresh cases, Rajasthan, which had 159, and Uttar Pradesh, which had 153 new cases.

In the process, Gujarat overtook Delhi as the state with the second highest number of cases in the country. Gujarat now has 2178 cases while Delhi, which added 75 new cases on Tuesday, has 2156.

Even Kerala reported a significant number of cases on Tuesday. Its 19 cases were the highest the state has reported in the last 20 days. Kerala now has 426 people who have tested positive for the infection.

📣 Express Explained is now on Telegram. Click here to join our channel (@ieexplained) and stay updated with the latest

Despite the large number of cases being added in the last few days, the spread of the disease in India has slowed down considerably as a result of the lockdown. India took eight days to travel from 10,000 cases to 20,000 cases. Before the impact of lockdown had become evident, the country was witnessing an exponential growth in the number of cases. It had taken around two weeks to move from three cases at the start of March to 100 cases, another two weeks to reach 1000 cases, and a little more than two weeks to touch the 10,000 figure. At that rate, the country would have on its way to reach one lakh cases by the end of the month. But thanks to the lockdown, and other measures taken by the government, all indications are that the total number of cases at the end of this month would be somewhere between 25,000 and 30,000.

Coronavirus (COVID-19): Medics wearing protective suits are seen in the premises of LNJP hospital, in New Delhi, Tuesday, April 21, 2020. (PTI Photo: Manvender Vashist) Coronavirus (COVID-19): Medics wearing protective suits are seen in the premises of LNJP hospital, in New Delhi, Tuesday, April 21, 2020. (PTI Photo: Manvender Vashist)

A large proportion of the fresh cases are being reported from only a handful of states. Maharashtra, Gujarat, Rajasthan and Uttar Pradesh together accounted for 75 per cent of all new cases on Tuesday. If the contributions of another four states – Tamil Nadu, Delhi, Madhya Pradesh, and Telangana – were included, it would account for more than 90 per cent of all new cases.

These were also the states where maximum number of deaths had happened. There were nineteen deaths in Maharashtra, some of which had happened earlier but could be confirmed only on Tuesday. Gujarat reported at least 13 deaths while Madhya Pradesh had eight, and Uttar Pradesh four.

Don’t miss these articles on Coronavirus from the Explained section:

‣ How coronavirus attacks, step by step

‣ Mask or no mask? Why the guidance has been shifting

‣ Besides a face cover, should I wear gloves when I go outdoors?

‣ How the Agra, Bhilwara and Pathanamthitta Covid-19 containment models differ

‣ Can coronavirus damage your brain?

📣 The Indian Express is now on Telegram. Click here to join our channel (@indianexpress) and stay updated with the latest headlines

For all the latest Explained News, download Indian Express App.

© The Indian Express (P) Ltd"
https://indianexpress.com/article/explained/donald-trump-us-immigration-coronavirus-6374059/,"President Donald Trump speaks about the coronavirus in the James Brady Press Briefing Room of the White House, Tuesday, April 21, 2020, in Washington. (AP Photo: Alex Brandon) President Donald Trump speaks about the coronavirus in the James Brady Press Briefing Room of the White House, Tuesday, April 21, 2020, in Washington. (AP Photo: Alex Brandon)

President Donald Trump said on Tuesday he will issue an executive order to temporarily suspend immigration to the United States to protect US workers amid the economic fallout from the coronavirus outbreak.

“It would be wrong and unjust for Americans laid off by the virus to be replaced with new immigrant labor flown in from abroad,” Trump said during a White House press briefing. “We must first take care of the American worker.”

Still, some questions remained unanswered on Tuesday as the Trump administration continued to work on the order, which follows a series of previous steps the president has taken to clamp down on legal immigration.

Trump immigration order: Who will be affected?

Trump said the executive order would only apply to immigrants seeking permanent residency in the United States, a process informally known as obtaining a green card. The order will not affect people entering on temporary non-immigrant visas, he said. Such visas are used by tourists, business travelers and foreign workers.

The US Department of State issued roughly 462,000 immigrant visas in fiscal year 2019, which began on Oct. 1, 2018. How many immigrant visa applicants might be affected by Trump’s planned executive order remains unclear.

In light of the attack from the Invisible Enemy, as well as the need to protect the jobs of our GREAT American Citizens, I will be signing an Executive Order to temporarily suspend immigration into the United States! — Donald J. Trump (@realDonaldTrump) April 21, 2020

Trump said the order, which could be signed as soon as Wednesday, will have exemptions, but did not provide details. Trump did not say what the executive order would mean for people who have immigrant visas and jobs secured in the United States but have not yet moved to the United States.

How long will the suspension last?

The suspension will last 60 days, according to Trump. After that, the president said he will review US economic conditions and decide whether it should be extended. Future extensions could potentially be longer than 60 days, Trump said.

What will happen to temporary foreign workers?

A senior administration official told Reuters the White House was considering a separate action that could deal with skilled workers who enter the country on H-1B visas and others affected by US immigration policy.

The potential executive order would include exemptions for people involved in responding to the coronavirus outbreak, including farm workers and those helping to secure US food supplies, the official said.

Trump said at the briefing Tuesday that he may issue a second order at a later date, but did not provide details.

Does Trump have the power to suspend immigration?

The Supreme Court ruled in 2018 that Trump could block the entry of certain foreigners from countries deemed a security threat, an affirmation of the president’s power to restrict legal immigration under federal law. Some legal experts argue the court’s ruling does not permit a broad, worldwide ban on immigration into the United States and expect any order to be challenged in court.

📣 Express Explained is now on Telegram. Click here to join our channel (@ieexplained) and stay updated with the latest

Andrea Flores, a deputy policy director with the American Civil Liberties Union, which has sued over a number of Trump immigration policies, said Trump appeared “more interested in fanning anti-immigrant flames than in saving lives” with his latest proposal.

Coronavirus ( Coronavirus ( COVID-19 ): Pedestrians cross at the intersection of Canal and Mott streets Tuesday, April 21, 2020, in New York. (AP Photo: Frank Franklin II)

How has Trump restricted immigration before?

The Trump administration has used several legal avenues to restrict travel to the United States in the past. Trump issued an executive order in late January that barred entry to certain travelers from China, where the coronavirus first surfaced. He similarly blocked certain travelers from Iran in February and Europe in March.

Also read | Putting all immigration on hold, tweets Trump; India waits for order, fine print

Well before the pandemic, Trump had issued travel bans for national security reasons. In late January, he added Nigeria and five other countries to a list of countries subject to visa restrictions.

What does immigration look like now?

The United States suspended routine visa services in most countries worldwide on March 18 due to the coronavirus outbreak, which was expected to dramatically slow legal immigration.In addition, countries around the world have closed their borders and enacted quarantines to limit the spread of the virus, greatly reducing travel worldwide.

The State Department issues monthly visa reports that illustrate the latest trends, but that data for March is not yet public.

Would blocking immigrants help the economy?

A record 22 million Americans sought unemployment benefits over the past month, nearly wiping out all the job gains since the Great Recession.

Trump said on Tuesday that an immigration suspension would protect US workers, an extension of the message he employed during his 2016 presidential campaign. The plan drew both praise and criticism.

Thomas Homan, Trump’s former acting director of US Immigration and Customs Enforcement, said it “makes sense” and will keep the country safer while preserving jobs for unemployed Americans.

Giovanni Peri, an economics professor at the University of California, Davis, said researchers generally agree that immigration into the United States has stimulated economic growth, increased the size of the economy and created jobs. “The idea that immigration threatens American jobs is just not there in any data,” he said.

Don’t miss these articles on Coronavirus from the Explained section:

‣ How coronavirus attacks, step by step

‣ Mask or no mask? Why the guidance has been shifting

‣ Besides a face cover, should I wear gloves when I go outdoors?

‣ How the Agra, Bhilwara and Pathanamthitta Covid-19 containment models differ

‣ Can coronavirus damage your brain?

📣 The Indian Express is now on Telegram. Click here to join our channel (@indianexpress) and stay updated with the latest headlines

For all the latest Explained News, download Indian Express App."
