url,text
https://indianexpress.com/article/opinion/columns/coronavirus-covid-19-federalism-states-narendra-modi-chief-ministers-6371517/,"There is a growing body of opinion that in the post-COVID world most countries will see governments playing a larger role in shaping people’s lives and determining their livelihoods. There is a growing body of opinion that in the post-COVID world most countries will see governments playing a larger role in shaping people’s lives and determining their livelihoods.

The Telugu Desam supremo, N T Rama Rao, once famously declared, “the Centre is a conceptual myth.” If Prime Minister Narendra Modi had not made his repeated post-lockdown appearances on television, most citizens dealing with the threat of COVID-19 and the challenge of the lockdown may well have felt the same way. From ensuring supply of water, food, electricity and health care to law and order, the government that a citizen deals with is the state government. Only in Delhi the police are under the Centre’s charge. The management of a sub-continental lockdown has brought into focus the role of state governments, their uneven capacities and capabilities and varying quality of provincial leadership — both political and bureaucratic.

There is a growing body of opinion that in the post-COVID world most countries will see governments playing a larger role in shaping people’s lives and determining their livelihoods. The return of big government and the prospect of a potentially larger role for the state in the economy raises the question, certainly in India, of what it would mean for Centre-state relations, and for national and provincial politics. The central government’s role will no doubt be important in the handling of the economic and financial aftermath, in reviving inter-state movement of people and goods, in re-negotiating international economic treaties to make them relevant to the new situation and so on. However, the immediate challenge of public health and medical care, as well as the continued supply of necessities, will remain the responsibility of state governments.

The manner in which the central and state governments resolve the problem of inadequate fiscal resources, given falling revenues due to the slowdown and rising claims on the public exchequer, will be a key issue in Centre-state relations. Several chief ministers have been complaining about the Centre’s lack of fiscal nerve, resolve and imagination in helping states. Kerala Finance Minister Thomas Isaac has dubbed it “crazy macroeconomics” (‘Ahead of the Covid curve’, IE, April 17). The Fifteenth Finance Commission, already given an extension and saddled with additional terms of reference, may have to look de novo at many new issues in federal finance given the fiscal imperatives of a post-COVID economy.

Editorial | Centre and states must sidestep conflict in crisis, agree on a common minimum programme on containment strategies

Given the constitutional division of responsibilities between the Centre and states, one issue that has fallen between two stools is the entire question of internal migration and the economic and social interests of domestic migrant labour. Historically, both home and host states have not acted responsibly in dealing with the welfare of migrant labour. Many states have, in fact, discriminated against migrant labour. The COVID lockdown has brought their welfare to the fore. Prime Minister Narendra Modi has ill-advisedly dissolved the National Development Council, but the problem of migration and migrant labour, especially in the current context, is a fit subject for a federal forum like the NDC to discuss.

Indian politics today presents a balance between the centripetal pull of the BJP’s Hindu nationalism and the centrifugal pull of regionalism. The management of the lockdown and its aftermath will determine the balance of power not just between Centre and the states, but between alternative political platforms. If chief ministers succeed in demonstrating their competence and compassion to their constituents, they can weaken the national base of a populist PM. Modi would surely be aware of this. In part, his media outreach may well be defined by his need to occupy public mind space at a time when most citizens are, in fact, turning to local political leadership for liberation from the lockdown.

In his first term, Prime Minister Modi was able to keep national attention focused on his foreign and economic policy initiatives as well as on national security and defence – all areas within the purview of the Centre and offering the PM the space to act. Modi’s second term got off to a wrong start with public attention focused on law and order, questions of citizenship and personal health. These issues have opened up political space for provincial leadership. Not only has the profile of non-BJP chief ministers like K Chandrashekar Rao and Pinarayi Vijayan gone up, but even BJP chief ministers like Yogi Adityanath seem to have acquired a political personality of their own. At the same time, the unsure start of PM Modi’s second term, damaged by a variety of factors, has made a PM with more numbers less sure of himself, mimicking the experience of the second Manmohan Singh government.

Opinion | Moving House Online: How crucial legislative work could continue in crisis

Ideally, at a time like this, any PM would want to shift public attention back to foreign affairs and national security to burnish his national image. However, the current economic and fiscal situation at home and globally offers little space for significant diplomatic initiatives. Most governments will remain focused on domestic affairs and policies. This policy context opens up the space for provincial leaders.

During the “era of coalitions” — from 1989 to 2014 — Centre-state relations were shaped by the decentralised politics of that period in which prime ministers were dependent on chief ministers both for their survival in office and to ensure delivery of public services and national initiatives. The arrival in office of a single party government, that too one headed by a domineering personality who has centralised governance while advocating “cooperative federalism”, suggested for a while that Indian politics was moving in the direction of greater centralisation of policy initiative.

Ironically, however, the ability of regional parties to retain their base and the resurgence of the Congress party in some states, thanks to provincial leaders rather than the party’s First Family, has created a dual power structure wherein chief ministers have become powerful functionaries once again. It used to be like this in the early 1950s and later in the early 1970s when, first under Jawaharlal Nehru and then under Indira Gandhi, the country saw a powerful PM working with powerful CMs. Since the 1990s, a succession of relatively weak PMs have had to work with relatively powerful CMs. Prime Minister Manmohan Singh handled this situation by frequently interacting with CMs and regularly convening CMs’ conferences. It was the COVID crisis that finally forced Modi to engage the CMs in an organised manner.

In the coming months, the focus of public policy will perforce shift to areas where state governments and provincial leaders will have to play a larger role. The only way in which the central government can re-assert its developmental role would be through massive public spending and investment. How competently that is done will have its own consequences for economic growth, political stability and Centre-state relations.

Opinion | The corona crisis threatens to write the obituary of global capitalism. It will have a lasting impact on national economic strategies and politics

This article first appeared in the print edition on April 21, 2020 under the title ‘Spotlight on the states’. The writer is a policy analyst and former media advisor to Prime Minister of India.

📣 The Indian Express is now on Telegram. Click here to join our channel (@indianexpress) and stay updated with the latest headlines

For all the latest Opinion News, download Indian Express App.

© The Indian Express (P) Ltd"
https://indianexpress.com/article/lifestyle/food-wine/british-royal-chefs-queen-elizabeth-birthday-chocolate-cupcake-recipe-buckingham-palace-coronavirus-pandemic-lockdown-easy-recipes-6373724/,"Would you like to try this royal bake recipe? (Source: The Royal Family/Instagram/FilePhoto;designed by Gargi Singh) Would you like to try this royal bake recipe? (Source: The Royal Family/Instagram/FilePhoto;designed by Gargi Singh)

Queen Elizabeth, the longest serving monarch, turned 94 years old on Tuesday. But there were no special celebrations as the Queen cancelled all plans amid the coronavirus pandemic, as per the Buckingham Palace. However, to bring in some cheer, The Royal Family’s official Instagram page shared a special Chocolate Cupcake recipe by royal pastry chefs.

The caption read, “Happy birthday to Her Majesty! To celebrate the Queen’s birthday we are sharing a chocolate cupcake recipe from The Royal Pastry Chefs.”

Time to treat yourself to some royal bakes.

Chocolate Cupcakes

Serves: 15 (approximately)

Ingredients for the cake sponges

15g – Vinegar

300ml – Milk

50ml – Vegetable oil

60g – Butter (melted and cool)

2 – Eggs

5ml – Vanilla essence

250g – Self-raising flour

75g – Cocoa powder

300g – Caster sugar

10g – Bicarbonate of soda

100g – White chocolate chips

Cupcake cases

Ingredients for the buttercream topping

90g – High percentage dark chocolate

100g – Butter

125g – Icing sugar

Option to also use Royal icing, instead of buttercream:

Royal icing available pre-made in shops

Add food colouring to create different colours

Cake sponge method

*Preheat the oven to 150 C.

*Combine flour, sugar, cocoa powder and bicarbonate of soda in a mixing bowl.

*Whisk the eggs in a separate jug with vanilla essence, melted butter, oil, milk and vinegar.

*Slowly add the wet mixture to the dry one.

*Ensure the batter is smooth with no lumps.

*Finally, add the chocolate chips (alternatives could be nuts, dried fruits).

*Lay the cupcake cases on a tray.

*Use a metal spoon to equally divide the mixture into the cases/moulds.

*Bake for around 15-18 minutes, take out of the oven when golden and springy to touch.

*Leave to cool.

Buttercream icing method

*Cream the sugar and butter together, until light and creamy

*Add in the warm melted chocolate

*If you have a piping bag to hand, pipe the icing on the top of cakes for decoration (otherwise gently use a teaspoon or small spatula to ice)

Royal icing method

*If decorating with royal icing, roll the icing out and cut into circular disks

*Lay the disc over the cupcake and mould to required shape

📣 The Indian Express is now on Telegram. Click here to join our channel (@indianexpress) and stay updated with the latest headlines

For all the latest Lifestyle News, download Indian Express App.

© IE Online Media Services Pvt Ltd"
https://indianexpress.com/article/north-east-india/assam/coronavirus-home-at-last-will-never-step-out-of-assam-again-6373287/,"Jadav Gogoi, who travelled 2,900 km from Gujarat to Assam, is now quarantined at Nagaon’s BP Civil Hospital. Express photo Jadav Gogoi, who travelled 2,900 km from Gujarat to Assam, is now quarantined at Nagaon’s BP Civil Hospital. Express photo

It is probably the first time in a month that Jadav Gogoi has smiled. And with good reason.

On Monday, Gogoi, a migrant worker from Assam, completed a journey of around 2,900 km, partly on foot, partly on a truck, battling storms, hunger and thieves to reach his hometown in Nagaon district.

“All I wanted to do was get home,” said a smiling Gogoi, on a video call from Nagaon’s BP Civil Hospital, where he is currently quarantined. Last month, when PM Narendra Modi announced the lockdown, Gogoi said the “company” he worked at for six months in Gujarat “chucked him out”. “There was no food, nor money, markets were closed,” he said, “If I had stayed, I would have starved and died.” It was then that Gogoi, along with a group of other migrants — none of whom was from Assam — decided to make the long journey home.

“Yes he is in Nagaon, but we are trying to ascertain the exact route and where he came from,” said Abhijit Gurav, Nagaon SP.

“We have sent our officers to verify the facts,” said Nagaon DC Jadav Saikia. “Officially we cannot comment on where he came from and how. We will know once we speak to him properly. He probably took a lift. It is unlikely he walked 3,000 km,” said Gurav.

Gogoi told his family he slept in bus stops, jironi ghors (rest houses that dot the highway), and ate when he was lucky. Gogoi told his family he slept in bus stops, jironi ghors (rest houses that dot the highway), and ate when he was lucky.

But the blisters on his feet tell another story — even if the details are a little unclear in Gogoi’s head. “I walked, there was a truck but they did not carry me the whole way,” he said.

Read | Delhi to Madhubani on a cart: ‘Would not have survived lockdown’

One of his co-travellers, Rakesh Kumar Yadav, a migrant worker from Varanasi confirmed that the group had left a place called Chandola (near Ahmedabad) together on March 25. “He [Gogoi] used to stay near us. He did not have a phone, he did not speak much Hindi. But we knew him,” said Yadav, who worked in ‘medicine delivery’ during his time in Gujarat. “So we took a bus on March 25, then a truck and when we finally reached Varanasi, he said to us ‘chale jaaonga’ and he left. That is when I last saw him.”

But before that, Gogoi had used Yadav’s phone to call home. “It was an unknown number and I was shocked to hear his voice,” said Rajen Phukan, Gogoi’s brother-in-law, who lives in Gadharia, the same village as Gogoi. “He told me that he had reached Uttar Pradesh and he was going to catch a bus to Bihar, and then walk home to Nagaon — to his wife and two children.”

Also Read | Central teams say Bengal not helping; Maharashtra wants trains for migrants

Phukan said they were worried but did not know how to help or whom to call. “It was a journey of 1,000 km. I told him it was a lockdown and that it was very dangerous to move around but he seemed to insist.”

Days passed and there was no news — till on April 13, Gogoi called again, this time he announced that he had just entered Barpeta district, about 300 km away. “Is it Bihu?” Gogoi had asked Phukan, “I can see people dressed and celebrating.”

And this is how the week followed: sporadic calls from different locations, snippets of information, before he would just disappear. Gogoi told his family that he slept in bus-stops, jironi ghors (rest houses, open to the elements, that dot the highway), and ate only when he was lucky.

“He mostly survived on biscuits and tea. During the big storm after Bihu, he put a stool on his head and somehow saved himself,” says Jayshree, Phukan’s wife. “He also said he was robbed of whatever money he had on the way…he told us he had set out with Rs 4,000.”

Explained | Indian migrants, across India

On April 19, Phukan received the final call from Gogoi. He had reached Ahotguri in Raha, about 45 km from Gadharia. “My niece and a few boys from the Asom Jatiyatabadi Yuva Chatra Parishad (AJYCP) alerted the police and rushed out in a car to fetch him,” said Phukan.

The group drove in the dark for about half an hour, till they spotted the man asleep in a jironi ghor (rest house) on the highway. “We called out to him — ‘khura (uncle), is that you?’” recalled Dibyajit Hazarika of AJYCP. “He woke up and said ‘how did you find me? I have walked for long and I cannot go any further.’”

The Nagaon police immediately rushed him to the hospital where Gogoi was put in quarantine. “We are testing him for COVID-19 and we expect the results tomorrow,” said J Ahmed, Superintendent of the Nagaon Civil Hospital, “He seems okay but tired. We will keep him for the mandatory 14 day period at the least.”

Gogoi does not mind. “I am happy to be here,” he said. But how he got there is something he would rather not talk about. “I was hungry, I was cold … I really do not have more to say,” said Gogoi from the hospital bed. “But one thing is for sure: never in my life will I step out of Assam again.”

📣 The Indian Express is now on Telegram. Click here to join our channel (@indianexpress) and stay updated with the latest headlines

For all the latest North East India News, download Indian Express App."
https://indianexpress.com/article/north-east-india/tripura/coronavirus-lockdown-schools-shut-children-in-tripura-city-take-to-graffiti-on-social-distancing-6372760/,"They hope people will find their paintings educational and will be inspired by them to stay at safe distance from each other during the outbreak. They hope people will find their paintings educational and will be inspired by them to stay at safe distance from each other during the outbreak.

A group of children, at home during the nationwide lockdown, have taken to painting graffiti on the novel coronavirus in Agartala city to spread awareness about the disease.

“We know coronavirus is spreading around the world and India is not outside its affect. So, we, residents of Melarmath, are trying to paint graffiti on walls here to spread awareness about social distancing and need to say safe during the outbreak”, Sayantika Saha, a 5th standard school student from the city’s Melarmath area, told reporters this afternoon.

Several adults were also seen joining in with the kids to paint a few brush strokes as well.

Sreyashi Ghosh, Srijoya Saha and few other school students from the area, said they have taken to painting graffiti since mass gatherings were found to be the main cause of coronavirus spread in different parts of the country. They hope people will find their paintings educational and will be inspired by them to stay at safe distance from each other during the outbreak.

The paintings include animated images of COVID-19, people getting affected by it, scribbling resembling COVID-19 trying to attack the Indian map from different sides. Cartoons with mask-clad characters and slogans of ‘Stay Home Stay Safe’ also found place in the graffiti.

Most kids have used paints available at their homes. They wore masks on their faces and stood quite apart from each other, in an apparent move to maintain social distancing, as they went on with their painting.

Two persons have been tested positive with COVID-19 in Tripura so far, out of whom one has already recovered and was released from state-run GB Panth Hospital, where she was being treated. The other patient, a TSR jawan, is still under treatment.

The state government has repeatedly stressed on maintaining social distancing and staying indoors during the outbreak, even as restrictions on certain essential businesses were relaxed during the lockdown.

📣 The Indian Express is now on Telegram. Click here to join our channel (@indianexpress) and stay updated with the latest headlines

For all the latest North East India News, download Indian Express App.

© IE Online Media Services Pvt Ltd"
